name,price,description,date,id
Bacon,166.00,"The Nagasaki Lander is the trademarked name of several series of Nagasaki sport bikes, that started with the 1984 ABC800J",2021-10-26T19:00:24.925Z,1
Bike,19.00,Ergonomic executive chair upholstered in bonded black leather and PVC padded seat and back for all-day comfort and support,2021-10-03T18:02:12.519Z,2
Towels,216.00,The slim & simple Maple Gaming Keyboard from Dev Byte comes with a sleek body and 7- Color RGB LED Back-lighting for smart functionality,2022-03-02T21:42:06.848Z,3
Hat,464.00,"The Nagasaki Lander is the trademarked name of several series of Nagasaki sport bikes, that started with the 1984 ABC800J",2022-05-20T11:46:17.171Z,4
Keyboard,819.00,"New ABC 13 9370, 13.3, 5th Gen CoreA5-8250U, 8GB RAM, 256GB SSD, power UHD Graphics, OS 10 Home, OS Office A & J 2016",2021-09-02T04:01:05.365Z,5
Hat,250.00,"The automobile layout consists of a front-engine design, with transaxle-type transmissions mounted at the rear of the engine and four wheel drive",2021-10-03T20:25:44.181Z,6
Chips,716.00,"Boston's most advanced compression wear technology increases muscle oxygenation, stabilizes active muscles",2022-03-25T01:19:45.404Z,7
Soap,673.00,The beautiful range of Apple Naturalé that has an exciting mix of natural ingredients. With the Goodness of 100% Natural Ingredients,2021-06-20T00:07:46.839Z,8
Bacon,306.00,New range of formal shirts are designed keeping you in mind. With fits and styling that will make you stand apart,2022-02-03T15:27:38.534Z,9
Bike,504.00,The Football Is Good For Training And Recreational Purposes,2021-11-17T05:18:05.217Z,10
